{
  "artifact_type": "naturalistic_pre_g6_contract",
  "contract_version": "naturalistic-pre-g6-contract-v2",
  "arc": "Naturalistic ConvMem product-value evaluation",
  "status": "PROPOSED_NOT_LOCKED",
  "supersedes": {
    "version": "naturalistic-pre-g6-contract-v1",
    "reviewed_commit": "82cc01a94ade8760c08df80512dbada410ca620d",
    "reason": "exact_review_found_digest_stage_identity_uncertainty_blindness_provenance_implementation_and_decision_registry_defects"
  },
  "provenance_roots": [
    {
      "id": "github_issue_263",
      "url": "https://github.com/alanmz-crypto/convmem/issues/263",
      "title": "Expose verbatim end-of-chat missives through retrieval",
      "state_at_contract_materialization": "OPEN",
      "relationship": "source_resolution_semantics_root",
      "required_invariant": "source_present_but_verbatim_evidence_unavailable_must_never_be_reported_as_source_absent"
    }
  ],
  "authorization": {
    "implementation_authorized": false,
    "g6_authorized": false,
    "t0_authorized": false,
    "naturalistic_execution_authorized": false,
    "product_disposition_authorized": false
  },
  "canonicalization": {
    "serialization": "RFC8785_JSON_CANONICALIZATION_SCHEME",
    "encoding": "UTF-8",
    "digest": "SHA-256(canonical_bytes)",
    "trailing_bytes": "PROHIBITED",
    "self_digest": "excluded_from_canonical_bytes",
    "sidecar": "docs/plans/artifacts/naturalistic-pre-g6-contract-v2.json.sha256",
    "validator": "docs/plans/artifacts/validate-naturalistic-pre-g6-contract-v2.mjs"
  },
  "normative_authority": {
    "canonical_contract": "docs/plans/artifacts/naturalistic-pre-g6-contract-v2.json",
    "schema": "docs/plans/artifacts/naturalistic-pre-g6-contract-v2.schema.json",
    "conformance_cases": "docs/plans/artifacts/naturalistic-pre-g6-contract-v2.conformance.json",
    "prose_role": "explanatory_projection_only",
    "conflict_rule": "canonical_contract_wins_and_prose_must_be_corrected_before_review",
    "derived_views": [
      "docs/plans/ARCHITECTURE-naturalistic-product-value.md",
      "docs/plans/EXECUTION-naturalistic-product-value.md"
    ]
  },
  "amendment_policy": {
    "construct_amendment_requires": [
      "new_contract_version",
      "new_canonical_digest_and_sidecar",
      "changed_field_manifest",
      "reason_and_scope",
      "outcome_blind_independent_review",
      "explicit_Ryan_authorization"
    ],
    "before_agent_a": "dependent_unstarted_artifacts_must_be_rebuilt_from_new_parent",
    "after_agent_a": "invalidate_dependent_study_generation;_never_retrofit_observed_outcomes",
    "same_authority_identity_with_changed_estimand": "PROHIBITED",
    "implementation_amendment_is_additional_to_construct_amendment": true,
    "validator": "V-AMENDMENT-AUTHORITY",
    "failure_transition": "INVALID_OR_BLOCKED"
  },
  "role_access_policy": {
    "roles": {
      "adjudicator": {
        "may_read": [
          "AdjudicationEvidenceViewV1"
        ],
        "may_not_read": [
          "OpaqueResolverManifestV2",
          "resolver_result",
          "capability_vector",
          "resolver_status",
          "resolver_assurance",
          "resolver_failure_reason",
          "resolver_paths_and_locators",
          "resolver_retry_count_and_timing",
          "resolver_queue_order",
          "resolver_timestamps",
          "resolver_missing_file_signals",
          "resolver_completeness_labels",
          "C0C1_outputs",
          "effects"
        ]
      },
      "controller": {
        "may_read": [
          "all_stage_manifests"
        ],
        "may_write": [
          "stage_transition_records",
          "digests",
          "controller_side_evidence_packages"
        ],
        "must_not_do": [
          "act_as_agent_b",
          "select_or_delete_targets",
          "edit_frozen_probes",
          "answer_or_search_for_agent_b"
        ]
      },
      "agent_b": {
        "may_read": [
          "ordinary_environment",
          "assigned_probe",
          "declared_condition_view"
        ],
        "must_not_read": [
          "TargetRegistryV2",
          "ScoringKeyManifestV2",
          "OpaqueResolverManifestV2",
          "controller_internals",
          "other_agent_b_session"
        ]
      }
    },
    "adjudication_interface": {
      "artifact": "AdjudicationEvidenceViewV1",
      "constant_shape": true,
      "condition_neutral_inventory_and_availability_allowed": true,
      "all_resolver_derived_fields_hidden": true,
      "resolver_join_stage": "P3_T2_BLINDED_ADJUDICATION_REGISTRY_SEAL",
      "validator": "V-ROLE-ACCESS-ADJUDICATION"
    },
    "canonical_field_name_enforcement": {
      "canonical_forbidden_p2_fields": ["resolver_result", "capability_vector"],
      "aliases": {
        "resolver_result": ["resolverResult", "resolver-result"],
        "capability_vector": ["capabilityVector", "capability-vector"]
      },
      "rule": "normalize_known_aliases_to_canonical_names_before_any_P1_or_adjudicator_allow_deny_decision",
      "unknown_alias": "DENY_AND_FAIL_CLOSED"
    },
    "unknown_or_unlisted_field": "DENY_AND_FAIL_CLOSED"
  },
  "stage_graph": [
    {
      "id": "P0_T0_CONSTRUCT_FREEZE",
      "parent": null,
      "parent_artifact": null,
      "parent_digest_field": null,
      "consumes": ["EXTERNAL:architecture_lock_candidate", "EXTERNAL:ryan_decision_values", "EXTERNAL:environment_inventory", "EXTERNAL:implementation_inventory"],
      "produces": ["ConstructFreezeManifestV2", "RoleAccessManifestV2", "DecisionRegistryInstanceV2", "ImplementationManifestV2", "EpisodeScheduleV2"],
      "authority_created": "construct_semantics_and_prospective_study_frame",
      "validator": "V-STAGE-P0",
      "failure_transition": "INVALID_NOT_STARTED",
      "required_fields": ["contract_digest", "decision_values_complete", "implementation_identities_complete", "episode_selection_rule", "role_access_policy", "source_class_policy", "scorer_semantics", "c0_c1_equality_policy"],
      "forbidden_fields": ["actual_source_occurrence_ids", "actual_evidence_snapshot_ids", "resolver_outputs", "natural_target_ids", "registry_membership", "agent_b_outputs", "scores", "effects"]
    },
    {
      "id": "P1_T1_EVIDENCE_SEAL",
      "parent": "P0_T0_CONSTRUCT_FREEZE",
      "parent_artifact": "ConstructFreezeManifestV2",
      "parent_digest_field": "construct_freeze_digest",
      "consumes": ["ConstructFreezeManifestV2", "EpisodeScheduleV2", "EXTERNAL:ordinary_episode_evidence"],
      "produces": ["EvidenceSealManifestV2", "EvidenceAvailabilityManifestV2", "AdjudicationEvidenceViewV1"],
      "authority_created": "actual_occurrence_revision_snapshot_and_evidence_envelope_authority",
      "validator": "V-STAGE-P1",
      "failure_transition": "DIAGNOSTIC_OR_BLOCKED_PER_CAPTURE_RULE",
      "required_fields": ["construct_freeze_digest", "occurrence_reference", "physical_instance_id", "revision_or_asof_id", "evidence_snapshot_id", "evidence_complete_envelope_digest", "canonical_content_digest", "canonicalization_profile_digest", "adapter_implementation_digest", "condition_neutral_evidence_availability"],
      "forbidden_fields": ["resolver_status", "resolver_failure_reason", "resolver_result", "capability_vector", "resolver_output_digest", "target_census", "target_ground_truth", "registry_membership", "probe_keys", "agent_b_outputs", "scores", "effects"]
    },
    {
      "id": "P2_OPAQUE_RESOLUTION",
      "parent": "P1_T1_EVIDENCE_SEAL",
      "parent_artifact": "EvidenceSealManifestV2",
      "parent_digest_field": "evidence_seal_digest",
      "consumes": ["ConstructFreezeManifestV2", "EvidenceSealManifestV2", "EvidenceAvailabilityManifestV2"],
      "produces": ["OpaqueResolverManifestV2"],
      "authority_created": "resolver_result_and_capability_vector_authority_hidden_from_adjudicators",
      "validator": "V-STAGE-P2",
      "failure_transition": "DIAGNOSTIC_OR_INTEGRITY_FAILURE",
      "required_fields": ["evidence_seal_digest", "resolver_implementation_digest", "resolver_input_digest", "resolver_result", "capability_vector", "resolver_output_digest"],
      "forbidden_fields": ["registry_membership", "probe_keys", "agent_b_outputs", "scores", "effects"]
    },
    {
      "id": "P3_T2_BLINDED_ADJUDICATION_REGISTRY_SEAL",
      "parent": "P2_OPAQUE_RESOLUTION",
      "parent_artifact": "OpaqueResolverManifestV2",
      "parent_digest_field": "resolver_output_digest",
      "consumes": ["ConstructFreezeManifestV2", "EvidenceSealManifestV2", "EvidenceAvailabilityManifestV2", "AdjudicationEvidenceViewV1", "OpaqueResolverManifestV2"],
      "produces": ["IndependentAdjudicationSetA", "IndependentAdjudicationSetB", "BlindedDisagreementResolutionV2", "TargetRegistryV2", "RegistryQualityReportV2"],
      "authority_created": "natural_target_census_ground_truth_unitization_and_registry_membership",
      "validator": "V-STAGE-P3",
      "failure_transition": "INVALID_DIAGNOSTIC_OR_BLOCKED",
      "required_fields": ["resolver_output_digest", "two_independent_decisions", "opaque_source_span_ids", "orthogonal_target_states", "semantic_unit_deduplication", "unknown_multiplicity_bounds", "registry_digest"],
      "forbidden_fields": ["resolver_status_in_adjudication_view", "assurance_vector_in_adjudication_view", "capture_state", "treatment_order", "agent_b_outputs", "scores", "effects"]
    },
    {
      "id": "T3_SAMPLE_SEAL",
      "parent": "P3_T2_BLINDED_ADJUDICATION_REGISTRY_SEAL",
      "parent_artifact": "TargetRegistryV2",
      "parent_digest_field": "registry_digest",
      "consumes": ["ConstructFreezeManifestV2", "TargetRegistryV2"],
      "produces": ["CensusAcceptanceV2", "EpisodeSampleManifestV2", "UnsampledRosterCommitmentV2"],
      "authority_created": "census_or_probability_sample_membership",
      "validator": "V-STAGE-T3",
      "failure_transition": "INVALID_DIAGNOSTIC_OR_BLOCKED",